{"assessorId":"assessor-1","sessionId":"018f06b5-3c8d-7b2a-9f35-8b3388a857b1","order":["A","B"],"promptLabel":"P1","sampleLabels":["A","B"],"sampleRatings":[{"label":"A","naturalness":4,"intelligibility":5,"listenability":4},{"label":"B","naturalness":3,"intelligibility":4,"listenability":3}],"preference":"A","replayCount":0,"submittedAt":"2026-08-06T12:00:00Z","revealLocked":true,"revealedAt":null,"note":"fixture"}
